{
  "$schema": "https://json-schema.org/draft/2020-12/schema",
  "$id": "https://local.invalid/auditing-ai-claims/assessment.schema.json",
  "title": "Claim assessment proposal",
  "type": "object",
  "additionalProperties": false,
  "required": [
    "claim_id",
    "source_identity_gate",
    "content_support_gate",
    "action_applicability_gate",
    "status",
    "confidence_reason",
    "conflicts",
    "next_step",
    "unknowns",
    "next_action"
  ],
  "properties": {
    "claim_id": {"type": "string", "minLength": 1},
    "source_identity_gate": {"enum": ["pass", "fail", "unknown"]},
    "content_support_gate": {"enum": ["pass", "partial", "fail", "unknown"]},
    "action_applicability_gate": {
      "enum": ["pass", "insufficient", "professional_review", "not_applicable", "unknown"]
    },
    "status": {
      "enum": ["confirmed", "partially_supported", "refuted", "unverifiable", "current_unknown"]
    },
    "confidence_reason": {"type": "string", "minLength": 1},
    "conflicts": {"type": "array"},
    "next_step": {"type": "string", "minLength": 1},
    "causal_basis": {
      "enum": [
        "not_applicable",
        "none",
        "correlational",
        "cross_sectional_self_report",
        "randomized_controlled_trial",
        "natural_experiment",
        "quasi_experimental",
        "longitudinal_with_identification",
        "systematic_review_of_causal_studies"
      ]
    },
    "as_of": {"type": "string"},
    "unknowns": {
      "type": "array",
      "minItems": 1,
      "items": {"type": "string", "minLength": 1}
    },
    "next_action": {"type": "string", "minLength": 1}
  }
}
